Title,Company,Location,Description
"Data Business Analyst- Quincy, MA",Ackerman Technologies,"Quincy, Massachusetts, USA","Position: Data Business Analyst Location: Quincy, MA (Day-1 Onsite) Duration: 6 Months with Possibility of extension Capable of creating presentations for regulators, audit, senior leadership associated with key outcomesBuild out processes and Standard Operating Procedures (SOP s)Role involves lot of stakeholder discussions, project co-ordination, sending out meeting notes and generate reportingThis is for migration from Hadoop to Databricks."
Technical Business Analyst W2,"ICS Global Soft, Inc.","Boston, Massachusetts, USA","Role: Technical Business Analyst Location: Boston, MA (Onsite) In-Person Interview This is a hybrid role, 3 days a week in office. Analysis: Generates all possible alternatives given the context of the opportunity/ issue Tries to quantify all business improvement opportunities. Makes quick and effective decisions Makes decisions on a basis of a holistic understanding Problem-solving Proficient problem-solving skills Identifies issues or causes for a problem and provides a recommended solution wi"
SharePoint Business Analyst (Local to North Carolina Preferred) | Remote Job| Webcam Interview,V Group Inc,"Remote or North Carolina, USA","For more details, please connect with Afra Aleem at Ext 112 or email him at Client: State of North Carolina Job Title: Business Analyst Duration: 12 Months Start Date: 03/03/2025 Location: 1020 Birch Ridge Dr. Raleigh, NC 27610 (Remote) Position Type: Contract Interview Type: Webcam Interview Only Ceipal ID: SNC_BA999_AF Department: State of North Carolina (NC DOT) Required Qualifications: Proven experience as a Business Analyst (5+ years) SharePoint experience with designing cu"
Senior Healthcare Business analyst/Product owner with some AI experience,"DATAMAXIS, Inc",Remote,"Job Summary: Collaborates with Product Owners to increase the value delivered to the Business units. Acting as a liaison between the Product Owner and Agile Team, elicits requirements and creates agile user stories while offering both technical analysis and alternative Business solutions. Performs testing of agile user stories and support the implementation of system changes. May lead and coordinate the mentoring and training of the Business Analyst Team on topics such as Business process, Busin"
Business Analyst UKG FP&A,"R Systems, Inc.",Remote,Looking for independent consultant who don t required sponsorship( W2 like and no H1B) Location: Remote role West Coast Duration: 12 months Job Description: Our client is in the process of implementing a new CRM and seeks 2 Business Analyst with Financial Planning & Analysis (FP&A) and Product Management background to help support the effort. These individuals need to be solidly experienced as they will be accountable for gathering requirements and translating these into steps required for sy
Qualtrics XM Discover Business Analyst,Nityo Infotech Corporation,Remote,"JD Qualtrics XM Discover Text Analytics Work with customers to define and document stakeholder s business requirements, understand key business challenges and develop the customer s vision into a value-based solution. Develop and leverage deep Qualtrics product knowledge to drive customer program maturity, platform adoption, and expansion opportunities. Build and maintain multi-level client stakeholder relationships to ensure customer health and to drive expansion within existing accounts as pro"
Business Systems Analyst - PME,Harvard University,"Remote or Boston, Massachusetts, USA","Position Description Reporting to the Director of Student Information Systems in IT, and working collaboratively with the Associate Director of PME Systems and Solutions and the Associate Registrar at HMS, the PME Business Systems Analyst will work closely with HMS and University constituents The Harvard Medical School Registrar's Office (HMS RO) supports the students, faculty, staff, and alumni of Harvard Medical School, inclusive of the Program in Medical Education (PME) and HMS Master's Prog"
BSA with QMS exp,Softnet Consulting Inc.,Remote,"BSA with QMS exp Loc: REMOTE WORK Duration: long term Expected Rate : $open/hr. on c2c JOB DUTIES AND RESPONSIBILITIES We are looking for a Business Systems Analyst (BSA) with expertise in Quality Management Systems (QMS), ideally with experience using ETQ, AssurX, or ComplianceQuest to join our team. The successful candidate will work within the Automotive and/or Semiconductor industries to enhance our quality management processes, ensuring that systems and solutions are aligned with regulator"
SAP Supply Chain Business Analyst,"SOAL Technologies, LLC.",Remote,"Key Responsibilities as a Contractor: (day to day of the role) Understand customer problems and anticipates their needs / Identifies client issues and approaches for determining potential solutions. Build proofs-of-concept (POC) for potential new solutions and technology Create and present functional and technical design including data analysis to business team, and seek feedback to influence solution design and approach Document functional business requirements, process flow diagrams, and busin"
Junior Business Analyst,Ellianse LLC,"Remote or Chicago, Illinois, USA","Position: Junior Business Analyst Full Time Multiple Locations : Chicago IL, Austin TX, Houston TX, Boston, MA ,NY, NJ, Washington DC, VA, NC, We are seeking a skilled and motivated Business Analyst to join our team. The ideal candidate will be responsible for analyzing business processes, identifying opportunities for improvement, and providing data-driven insights to support strategic decision-making. Key Responsibilities: Requirements Gathering: Collaborate with business stakeholders to unde"
Business Analyst - (Investment Operations),"Computer Merchant, Ltd., The","Boston, Massachusetts, USA","JOB TITLE: Business Analyst JOB LOCATION: Hybrid/Boston or Springfield. Boston Preferred WAGE RANGE*: $70-$76/hr. JOB NUMBER: 35742704 REQUIRED EXPERIENCE: Bachelor's degree in Finance, Business Administration, or a related field. 5+ years of experience as a Business Analyst within investment operations, trade lifecycle, or cash clearing environments. Strong understanding of trade flow processes, including trade execution, clearing, and settlement. Familiarity with industry-standard clear"
Sr. SAP FICO Business Analyst,DFND Security,Remote,"We are looking for a Sr. SAP FICO Business Analyst for a remote position expected to last at least 6-12 months and preferably a contract to hire. No 3rd parties and No sponsorship available. This role gives an opportunity to be a part of the current SAP S/4 HANA upgrade journey. Some more details are below. The SAP FICO Business Analyst will utilize business tools like process maps, value stream maps, data flow diagrams, functional requirement specifications and project management to govern docu"
Hybrid: Business Analyst with Data Bricks and Hadoop,Script2IT,"Quincy, Massachusetts, USA","We have a staffing position for experienced Business Analysts role with exposure in Hadoop and Databricks data mapping, requirements gathering etc. Capable of creating presentations for regulators, audit, senior leadership associated with key outcomesBuild out processes and Standard Operating Procedures (SOP s)Role involves lot of stakeholder discussions, project co-ordination, sending out meeting notes and generate reporting This is for migration from Hadoop to Databricks."
Business Analyst Security Master,The Ceres Group,"Boston, Massachusetts, USA","We are currently looking for a BA to work in our product team. This could be a contractor role or contract-hire. Target candidate: 5+ years financial servicesSolid reqs writing skills and experienceData mapping and data requirementsKnows SQL/ demonstrated skills for data analysis in relational dbSecurity master, issuer data expertiseBIG Plus for candidates with BBG security master and issuer data experience"
Sr. SAP FICO Business Analyst,DFND Security,Remote,"We are looking for a Sr. SAP FICO Business Analyst for a remote position expected to last at least 6-12 months and preferably a contract to hire. No 3rd parties and No sponsorship available. This role gives an opportunity to be a part of the current SAP S/4 HANA upgrade journey. Some more details are below. The SAP FICO Business Analyst will utilize business tools like process maps, value stream maps, data flow diagrams, functional requirement specifications and project management to govern docu"
Business Analyst CI/CD Dev Ops,The Ceres Group,"Boston, Massachusetts, USA","You will join our team and play a key role in building and refining CICD systems that enable rapid innovation and delivery across our global platform. Your work will ensure that our development and operations teams can work seamlessly to meet client needs efficiently and at scale. We are seeking several business analyst to lead our Continuous Integration and Continuous Deployment (CI/CD) teams. The role is focused on optimizing existing CI/CD processes, enabling modernization through Infrastruc"
Investment Business Analyst,eRichards Consulting,"Boston, Massachusetts, USA","Our excellent client is seeking an Investment Business Analyst for a 4 months+ HYBRID contract in Boston or Springfield. MUST BE ABLE TO WORK ON OUR W2. NO AGENCIES PLEASE. The ideal candidate will have a deep understanding of trade flows and cash clearing processes, coupled with strong analytical and communication skills to bridge the gap between business stakeholders and technical teams. Lead requirements definition sessions ensuring that the team articulates requirements and specifications. U"
Business Analyst Cash Flow,The Ceres Group,"Boston, Massachusetts, USA","As a member of the IT group, the contract Senior Business Analyst will assume responsibility for supporting ongoing cashflow-related projects within the firm s various Client Service, Operations, and Portfolio Construction Teams. This highly visible position will have direct exposure to many business groups and provide daily data analysis, application support, and project support for existing and new projects. The ideal candidate should have a strong background in business systems analysis, part"
BA with Commerce (CCW) - Remote - Only on W2,XFORIA Inc,Remote,"Job Details: Business Analyst - Commerce (CCW) Remote Contract on W2 Job Description: Responsibilities of BA - CCW: Need to have hands on experience in CCW/CCWR processes, and system functionality.Looking for someone who knows the CCW/CCWR interface, can review Jira changes and understand what they mean to our internal and external stakeholders.Then create communications, training materials, and presentations then speak to them in simple terms."
Duck Creek Business Analyst,Optime Tech,Remote,"Duck Creek Business Analyst (Policy) 100% Remote ( In United States) 12+ Month Contract Business Analyst in the insurance domain (preferably P&C Insurance). Job Details: Hands-on experience with Duck Creek Policy, Billing, Claims, or Insights modules. Familiarity with Duck Creek Author, Forms, and Rating is highly desirable. Proficiency in documenting requirements using tools like JIRA, Confluence, or other project management tools. Knowledge of integration workflows, APIs, and web services"
Salesforce Business Analyst,Smart Synergies,Remote,"100% Remote Our client is seeking a highly motivated and experienced hands-on Salesforce Business Analyst to join the Enterprise Applications Business Analyst team. This role involves leading and contributing to critical business initiatives through effective process enablement and collaboration. As a Salesforce Business Analyst, you would analyze business processes, gather requirements, design Salesforce solutions, test solutions, and may manage small projects. The ideal candidate would also ha"
Business Systems Analyst (Payment Industry ),AgreeYa Solutions,Remote,"Job Title: Business Systems Analyst - Level Location: Remote Duration: 12 months 48706-1 Description: Reviews, analyzes, and evaluates user needs to create systems solutions that support overall business strategies. Documents system requirements, defines scope and objectives, and creates system specifications that drive system development and implementation. Incumbents function as a liaison between IT and users and have both business and technical expertise. Required Skills: [Payment Industry E"
ServiceNow Business Analyst / Scrum Master,TalTeam,Remote,"Position : ServiceNow Business Analyst / Scrum Master Location : Reston Virginia Direct Client Requirement Job Summary: Facilitate requirements gathering workshops, stakeholder meetings, and user story writing sessions to capture business needs and priorities. Translate business requirements into clear and concise user stories, acceptance criteria, and sprint backlog items. Collaborate with development teams to ensure alignment between business needs and technical solutions. Serve as a scrum m"
"Business Analyst (Government project) - Hybrid role - Baton Rouge, LA",Acnovate Corporation,"Remote or Baton Rouge, Louisiana, USA","Business Analyst (Government project) Hybrid role - Baton Rouge, LA Long term Contract Analyze and document ECE s business functions and processes, including areas where cross-functional collaboration across agency departments is critical; Analyze the integration of ECE s business functions with LDOE systems of record; Maintain a working knowledge of accounting, procurement, finance or contract management; Assist with business case development and business process reengineering; Consult with ma"
Business Systems Analyst / Data Analyst with IBOR / ABOR or Reference Data - Boston,Yoh - A Day & Zimmerman Company,"Boston, Massachusetts, USA","Please contact Renu Goel Please do not send resume without IBOR/ABOR or reference data exp Position Overview: We are looking for an experienced Business Systems / Data Analyst to lead analysis and design activities for a replatforming project centered around reference and master data management across multiple workstreams. This role is crucial in understanding complex data systems, writing detailed requirements, and collaborating closely with business users to deliver solutions. If you have a s"
System Business Analyst,"NTT DATA Americas, Inc","Remote or Plano, Texas, USA","About NTT DATA:NTT DATA is a $30 billion trusted global innovator of business and technology services. We serve 75% of the Fortune Global 100 and are committed to helping clients innovate, optimize and transform for long term success. As a Global Top Employer, we have diverse experts in more than 50 countries and a robust partner ecosystem of established and start-up companies. Our services include business and technology consulting, data and artificial intelligence, industry solutions, as well"
Technical Business Analyst - Salesforce,Software Guidance & Assistance,"Boston, Massachusetts, USA","Software Guidance & Assistance, Inc., (SGA), is searching for a Business Analyst for a CONTRACT assignment with one of our premier Financial Services clients in Boston, MA. Responsibilities: Work closely with other members of the team to perform data analysis, solutions design, testing, and release management across multiple systems Assist team members in evaluating and implementing vendor tools and processes. Ability to work with non-technical end users to interpret and document user requir"
Senior Business Analyst,"NTT DATA Americas, Inc","Remote or Pittsburgh, Pennsylvania, USA","About NTT DATA: NTT DATA is a $30 billion trusted global innovator of business and technology services. We serve 75% of the Fortune Global 100 and are committed to helping clients innovate, optimize and transform for long term success. As a Global Top Employer, we have diverse experts in more than 50 countries and a robust partner ecosystem of established and start-up companies. Our services include business and technology consulting, data and artificial intelligence, industry solutions, as well"
Business Analyst with Oracle R12 is preferred,Everest Technologies,Remote,"3-5+ yrs of experience performing business analysis within a large enterprise covering both business and information technology domainsAbility to use querying languages to extract and analyze data (e.g. SQL)3-5+ yrs of experience working with a major ERP system, Oracle R12 preferredFunctional knowledge in as many of the following as: P2P, OTC, Project Accounting, Inventory, WIP, BOM"
Clinical Business Analyst - Remote,Vaco Technology,Remote,"This is W2 contract opportunity. No C2C allowed. We are seeking a Clinical Business Analyst (BA) with experience in Care Management (CM) and Utilization Management (UM). The BA will act as a bridge between business and IT, supporting new market implementations and expansions. Role Focus: Not highly technical but must understand clinical processes. Work Model: Primarily remote, minimal travel. Contract Duration: Long-term (through 2026+) Key Responsibilities 1. Care Management & Utilization Man"
Salesforce Business Analyst,Aditi Consulting,"Remote or Dallas, Texas, USA","Job Title Salesforce Business Analyst Request #57415-1 Location: Remote Duration - Thru end of year (2025); possibility to be extended Education & Experience Required: This position requires an accredited, four-year Marketing, Business, or Technology degree, a closely related technical degree, or equivalent experience. plus 5+ overall years professional expMasters degree with 3+ years overall professional experienceAssociates degree/ No degree they will need at a minimum 7+ years of relevan"
Mainframe Business analyst,Data Capital Inc,"Quincy, Massachusetts, USA","Applicant should have a strong legacy mainframe background. Position requires writing of functional requirements, researching application functionality and recommending development solutions to a third-party development team. Knowledge and previous experience utilizing COBOL, Easytrieve, IMS, VSAM, JCL, SQL and DB2 is desirable. Actual development work will not be required. Position requires overseeing development activities and reviewing test results by a third-party vendor. Conducting UAT with"
Business Analyst - Salesforce CPQ & OTC,"Ekman Associates, Inc.","Remote or Chicago, Illinois, USA","Job DescriptionTitle: Business Analyst (Financial / Salesforce CPQ & OTC) Location: RemoteEkman Associates is a management consulting firm that specializes in developing business, digital, and technology strategy, delivering solutions, and addressing human resource demands.SUMMARY: Seeking a highly analytical Data Analyst with Data Extraction Analysis experience and with Accounting knowledge/experience to extract and analyze financial/accounting data from various systems (including Salesforce)."
Senior Data Developer/Business Analyst,"Judge Group, Inc.","Quincy, Massachusetts, USA","Location: Quincy, MA Salary: $65.00 USD Hourly - $70.00 USD Hourly Description: Our client is currently seeking a Senior Data Developer/Business Analyst in Quincy, MA (Hybrid) The ideal candidate is an expert in project requirement analysis, data management and analysis, collaboration with internal and external stakeholders, documentation of requirements, translation of business requirements to technical specs, presentations and project management when needed. You can clearly articulate an"
"REDCAP APPLICATIONS DEVELOPER/BUSINESS ANALYST, BEDAC",Boston University,"Boston, Massachusetts, USA","Job Description Job Description We are seeking a REDCap Applications Developer/Business Analyst (BA) who will serve as the technical lead for the development of REDCap systems in our research-computing environment. The role of a business analyst requires the development of system requirements and specifications, entity relationship, work and data flow diagrams, data dictionaries and testing plans. The role of this developer requires the development and validation of clinical systems. The positi"
Jr. Business Systems Analyst,Information Technology Group,Remote,"Under limited supervision, the Business Systems Analyst supports IT goals and objectives by working closely with Project Managers, IT Managers, and business stakeholders to ensure application development and implementation meets the business requirements. Work with internal and external off-site Project Managers, Technical Designers and Developers, and other key stakeholders to identify and document requirements and use cases in a manner that is accurate and meaningful to business and IT profess"
Business Analyst (Independents only),"Primesoft, Inc","Remote or New York, New York, USA","Greetings from Primesoft Inc!!Hope you are doing well!! Business Analyst Remote Experience as a Business Analyst in a fast-paced, data-driven environmentSQL skills with the ability to write complex queries and manipulate large datasetsExcellent communication skills, with the ability to translate technical concepts to non-technical audiencesStrong analytical and problem-solving skills with attention to detail Regards Naveen P naveen dot p at primesoftinc dot com"
Card Payments Business Analyst ::: Full Time role ::: Only EST or CST candidates,REDLEO SOFTWARE INC.,Remote,"Role: Payments Business Analyst Remote Summary: THE CLIENT Pay Later One Time Payments and Recurring Payments THE CLIENT Pay Later One Time Payments and Recurring Payments THE CLIENT Pay Later Waived Interest One Time Payments and Recurring Payments THE CLIENT Pay Later Intro Rate Loan One Time Payments and Recurring Payments CLIENT One Time Payments CLIENT Recurring Payments Revolving Bill Pay Revolving Autopay Enrollment, Modification, and Unenrollment Revolving Autopay Limited Series Enro"
IAM Business Analyst,Oxford Global Resources,Remote,"IAM business analyst Location: REMOTE (CST Business hours) Length: 12 months + potential extensions Client is seeking a business analyst for staff augmentation to help with day to day operations and overall analysis of their existing access roles structures, gathering facts, meeting with stakeholders, using tools to gather information, applying PowerBI, and reviewing Roles Based Access Controls (RBAC). The ticketing system they use is Cherwell and while the client doesn t require previous experi"
Business Analyst - Senior,TalentBurst,"Framingham, Massachusetts, USA","Title: Business Analyst Duration: 12+ Months Location: Framingham, MA (Remote) 1 year contract with the potential to extend Contract to perm talent only (no open FTE at this time) This position will be working on our Workforce Management solution within the Back of Stores domain. We are our supporting the implementation of Workday and this position will be assisting on the successful integration of our WFM platforms (WFC & PRO). In this role, the ideal candidate will: - Have experience wit"
Senior Business Systems Analyst,Harvard University,"Cambridge, Massachusetts, USA","Position Description Harvard University Information Technology (HUIT) is a community of Information Technology professionals committed to delivering service and technological solutions in support of teaching, learning, research and administration. Our mission is to make it easier for faculty, students, and staff to teach, research, learn, and work through the effective use of information technology. We are recruiting an IT workforce that has both breadth in their ability to collaborate and inno"
Technical Business Analyst,Prutech Solutions,Remote,"Role: Technical Business Analyst Location: Charlotte, NC - Remote Long Term Contract ACH technology (Top Priority) Candidate should understand ACH (Primarily fulfilling) ACH is one of the payment Channels and has worked on Fiserv-PEP+The candidate needs to analyze the bank's current system, support existing day-to-day troubleshooting, define requirements, and document them as part of a backlog that would help define modernization with a new tech stack.Candidate should come from the domain side"
Healthcare Business Analyst,Mindlance,Remote,"Business Analyst Location - Baltimore, Maryland Duration: 12 Months contract Job Description Healthcare Experience - with Enrollment Facets Experience Data analysis Advanced excel (perf)"
Business Systems Analyst & Configuration Specialist,TalentFish LLC,Remote,"Job Title: Business Systems Analyst & Configuration Specialist Position: Contract 6+ Months (Potential for full-time hire after contract*) Location: Remote US, Chicago Area Preferred *This is a 6+ month contract with potential for full-time hire conversion after contract. Candidates open potential full-time must be able to work hybrid onsite in Chicago, IL 2-days per week after full-time conversion. TalentFish is seeking a Business Configuration Analyst PM/BA for a remote contract role with p"
Financial Business Analyst,Eliassen Group,"Framingham, Massachusetts, USA","Description: Applicants must be local to Framingham MA area. Our client is seeking a Financial Business Analyst. This is a contract to hire opportunity. Applicants must be willing and able to work on a w2 basis and convert to FTE following contract duration. For our w2 consultants, we offer a great benefits package that includes Medical, Dental, and Vision benefits, 401k with company matching, and life insurance. Rate: $55 - $65 / hr. w2 Responsibilities: Perform financial planning and anal"
