Title,Company,Location,Description
Technical Business Analyst,Eliassen Group,"Framingham, Massachusetts, USA","Description: Applicants must be local to Framingham MA area. Our client is seeking a Technical Business Analyst. This is a contract to hire opportunity. Applicants must be willing and able to work on a w2 basis and convert to FTE following contract duration. For our w2 consultants, we offer a great benefits package that includes Medical, Dental, and Vision benefits, 401k with company matching, and life insurance. Rate: $55 - $65 / hr. w2 Responsibilities: Develop and execute intermediate-lev"
Business Analyst,"Zachary Piper Solutions, LLC",Remote,"Piper Companies is seeking a Business Analyst for a pharmaceutical marketing organization in a 100% remote capacity. This is a 4-6 month contract opportunity. The Business Analyst will support the integration of Salesforce Marketing Cloud with a large internally built data lake. Responsibilities of the Business Analyst: Collaborate with stakeholders to understand business needs and translate them into clear requirements. Gather, analyze, and document business and technical requirements for sys"
Business Analyst (Finance),Oxford Global Resources,"Remote or Dodgeville, Wisconsin, USA","Role: Business Analyst (Finance) Start: 3/10 LOA: 5-6 months Location: Remote - if local/regional to WI onsite 1x/month Situation: Client is seeking a Business Analyst to join their team. They are heading into the Testing Phase of an SAP implementation and a Manhattan WMS implementation with go live dates of 8/1. This candidate will be working within an existing workstream and joining the project as they head into testing. They will be managing documentation, requirements gathering, reporting, a"
Business Analyst,Hirekeyz,Remote,"Role: Business Analyst Location: Remote Job Type: Full Time Job Description:Business Analyst with: EDI + 834,835,837Minimum of 8 or more years of related work experienceStrong analytical skillsKnowledge of Healthcare industry"
Business analyst,"TekLeaders, Inc","Remote or Canada, Kentucky, USA","Hi, Please check the below position and get back to me asap. Senior BA - Canada - remote Long term Programming Skills in Sql Heathcare Logistics and scheduling EXP"
SAP Business System Analyst,Kavyos Consulting Inc,"Mansfield, Massachusetts, USA","The Senior Business Systems Analyst is responsible for ensuring that all Corporate Business Systems meet the Corporate reporting requirements. This position collaborates with IT and Global Accounting Teams to evaluate business needs and develop and enforce procedures and policies. The ideal candidate for this position will have Accounting and SAP FICO experience as well as a strong understanding of Lease Accounting (ASC 842 / IFRS16). This person shows an eagerness to learn and support, both Lea"
Business Systems Analyst,Montek System,Remote,"BSA with QMS exp Location: US Remote Domain Must: Automotive or Semiconductor Business Systems Analyst (BSA) with expertise in Quality Management Systems (QMS), ideally with experience using ETQ, AssurX, or ComplianceQuest to join our team. The successful candidate will work within the Automotive and/or Semiconductor industries to enhance our quality management processes, ensuring that systems and solutions are aligned with regulatory standards and business needs. Collaborate with key stakeholde"
Business Analyst,Cloud Bigdata,"Remote or Chicago, Illinois, USA","Role Description: BA will be responsible for creating and reviewing Use Case, writing requirements, etc. Must have broad experience in agile software development methodologies and must be familiar with SDLC Must have good experience working with business and technology teams to deliver top digital experiences Must have good work experience in assisting Product Owners and Product Managers in documenting the business process and creation of epics, features and user stories to be consumed by techno"
100% Remote - Only W2 - Business Systems Analyst with CBAP certification,Ledelsea,Remote,"Need to have CBAP certification - Position: Business Systems Analyst Location: 100% Remote - St. Paul, MN 55106 Duration: 6+Months Start Date: March 1, 2025 Minimum of 5 years of experience as a BA (highly skilled in gathering and documenting business requirements, and excellent communication skills both written and verbal) Experience with one or more of these tools: Drupal, WordPress or Sitecore Experience in working on web-based platform or content management system projects. Experience with"
